{
  "id": "core.service_focused",
  "version": 1,
  "category": "service",
  "industries": [],
  "labels": {
    "pl": {
      "name": "Jedna usługa — konkret",
      "description": "Strona jednej usługi, która prowadzi do telefonu: potrzeba klienta, zakres w skrócie, dla kogo jest usługa, przebieg wizyty, przygotowanie, pytania i prośba o oddzwonienie. Przykład: korekcja racic z dojazdem do gospodarstwa; wymień treści demonstracyjne przed publikacją."
    },
    "en": {
      "name": "One service, to the point",
      "description": "A single-service page that leads to a phone call: the customer’s need, the scope at a glance, who it is for, how a visit works, preparation, questions and a call-back request. Example: on-farm hoof trimming; replace the demonstration content before publishing."
    }
  },
  "requiredEntitlements": ["sites.enabled"],
  "pagePresentation": {
    "schemaVersion": 2,
    "width": "full",
    "style": "organic"
  },
  "conversion": {
    "goal": "call",
    "stages": [
      "attention",
      "interest",
      "interest",
      "interest",
      "objection",
      "objection",
      "action"
    ]
  },
  "blocks": [
    {
      "block_type": "core.hero",
      "schema_version": 6,
      "data": {
        "title": "Korekcja racic w Twojej oborze, bez wywożenia stada",
        "text": "Dla hodowców bydła mlecznego i mięsnego. Przyjeżdżamy z poskromem, pracujemy na miejscu i po wizycie zostawiamy krótki zapis dla każdej sztuki. Dojeżdżamy do gospodarstw w okolicy: [Uzupełnij: powiaty lub promień dojazdu].",
        "action": {
          "label": "Zadzwoń i ustal termin",
          "href": "tel:+48000000000"
        },
        "secondaryAction": {
          "label": "Poproś o oddzwonienie",
          "href": "#kontakt"
        },
        "layout": "split"
      },
      "presentation": {
        "schemaVersion": 2,
        "inner": "wide"
      }
    },
    {
      "block_type": "core.rich_text",
      "schema_version": 3,
      "data": {
        "layout": "summary_box",
        "eyebrow": "Zakres usługi",
        "title": "Co dostajesz w ramach jednej wizyty",
        "lead": "Jedna usługa wykonana porządnie od początku do końca – bez pakietów, w których trudno się połapać.",
        "content": [
          {
            "type": "paragraph",
            "content": [
              {
                "text": "Oglądamy racice każdego zwierzęcia, które wskażesz, korygujemy je i opatrujemy miejsca, które tego wymagają. Jeśli zauważymy coś, co trzeba leczyć, mówimy wprost, kiedy potrzebny jest lekarz weterynarii."
              }
            ]
          },
          {
            "type": "list",
            "style": "bullet",
            "items": [
              {
                "content": [
                  {
                    "text": "ocena racic i korekcja u wskazanych zwierząt,"
                  }
                ]
              },
              {
                "content": [
                  {
                    "text": "opatrzenie zmian, które tego wymagają,"
                  }
                ]
              },
              {
                "content": [
                  {
                    "text": "krótki zapis dla każdej sztuki: co zrobiliśmy i na co zwrócić uwagę,"
                  }
                ]
              },
              {
                "content": [
                  {
                    "text": "propozycja terminu kolejnej wizyty dopasowana do stada,"
                  }
                ]
              },
              {
                "content": [
                  {
                    "text": "[Uzupełnij: co jeszcze obejmuje wizyta, np. opatrunki lub klocki ortopedyczne]."
                  }
                ]
              }
            ]
          }
        ],
        "aside": {
          "title": "W skrócie",
          "content": [
            {
              "type": "list",
              "style": "bullet",
              "items": [
                {
                  "content": [
                    {
                      "text": "Dla kogo:",
                      "bold": true
                    },
                    {
                      "text": " gospodarstwa z bydłem mlecznym i mięsnym."
                    }
                  ]
                },
                {
                  "content": [
                    {
                      "text": "Gdzie:",
                      "bold": true
                    },
                    {
                      "text": " w Twojej oborze albo przy wybiegu."
                    }
                  ]
                },
                {
                  "content": [
                    {
                      "text": "Ile trwa:",
                      "bold": true
                    },
                    {
                      "text": " [Uzupełnij: orientacyjny czas pracy przy stadzie danej wielkości]."
                    }
                  ]
                },
                {
                  "content": [
                    {
                      "text": "Koszt:",
                      "bold": true
                    },
                    {
                      "text": " [Uzupełnij: widełki ceny za sztukę albo zasady wyceny i koszt dojazdu]."
                    }
                  ]
                },
                {
                  "content": [
                    {
                      "text": "Po wizycie:",
                      "bold": true
                    },
                    {
                      "text": " zapis dla każdej sztuki i termin kolejnej wizyty."
                    }
                  ]
                }
              ]
            }
          ]
        }
      },
      "presentation": {
        "schemaVersion": 2,
        "inner": "standard",
        "surface": "muted"
      }
    },
    {
      "block_type": "core.rich_text",
      "schema_version": 3,
      "data": {
        "layout": "two_parts",
        "eyebrow": "Czy to dla Ciebie?",
        "title": "Zanim zadzwonisz, sprawdź, czy się dogadamy",
        "lead": "Wolimy powiedzieć od razu, z czym przyjedziemy, a z czym lepiej zwrócić się do kogoś innego.",
        "content": [
          {
            "type": "heading",
            "level": 2,
            "anchor": "dla-kogo",
            "text": "Zadzwoń, jeśli…"
          },
          {
            "type": "list",
            "style": "bullet",
            "items": [
              {
                "content": [
                  {
                    "text": "chcesz, żeby korekcja odbywała się na miejscu, bez przewożenia zwierząt,"
                  }
                ]
              },
              {
                "content": [
                  {
                    "text": "wolisz stały rytm wizyt niż wzywanie pomocy dopiero wtedy, gdy krowa kuleje,"
                  }
                ]
              },
              {
                "content": [
                  {
                    "text": "zależy Ci na zapisie, z którego po kolejnych wizytach wyczytasz, co dzieje się w stadzie,"
                  }
                ]
              },
              {
                "content": [
                  {
                    "text": "chcesz rozmawiać z osobą, która przyjedzie do Twojego stada, a nie z infolinią."
                  }
                ]
              }
            ]
          },
          {
            "type": "heading",
            "level": 2,
            "anchor": "dla-kogo-nie",
            "text": "Lepiej zadzwoń do kogoś innego, jeśli…"
          },
          {
            "type": "list",
            "style": "bullet",
            "items": [
              {
                "content": [
                  {
                    "text": "zwierzę wymaga pilnego leczenia – wtedy pierwszy telefon kieruj do lekarza weterynarii,"
                  }
                ]
              },
              {
                "content": [
                  {
                    "text": "gospodarstwo leży poza obszarem, w którym pracujemy: [Uzupełnij: obszar dojazdu],"
                  }
                ]
              },
              {
                "content": [
                  {
                    "text": "[Uzupełnij: czego nie robisz, np. korekcji u innych gatunków zwierząt]."
                  }
                ]
              }
            ]
          }
        ]
      },
      "decoration": {
        "schemaVersion": 1,
        "ornament": "botanical",
        "placement": "bottom_left",
        "intensity": "subtle"
      },
      "presentation": {
        "schemaVersion": 2,
        "inner": "standard"
      }
    },
    {
      "block_type": "core.feature_list",
      "schema_version": 4,
      "data": {
        "title": "Jak przebiega wizyta",
        "lead": "Od telefonu do zapisu po wizycie. Przy każdym kroku piszemy, czego potrzebujemy od Ciebie.",
        "items": [
          {
            "title": "Telefon i termin",
            "text": "Ustalamy, ile zwierząt obejrzymy, gdzie stanie poskrom i który dzień pasuje do rytmu pracy w gospodarstwie."
          },
          {
            "title": "Przyjazd i ustawienie sprzętu",
            "text": "Przyjeżdżamy o umówionej porze i ustawiamy poskrom tam, dokąd łatwo doprowadzić zwierzęta. Potrzebujemy równego podłoża i kogoś, kto zna stado."
          },
          {
            "title": "Korekcja sztuka po sztuce",
            "text": "Pracujemy spokojnie, bez pośpiechu. Jeśli zauważymy coś, co wymaga leczenia, od razu Ci to pokażemy."
          },
          {
            "title": "Omówienie przed wyjazdem",
            "text": "Mówimy, co zauważyliśmy w stadzie, i proponujemy termin kolejnej wizyty."
          },
          {
            "title": "Zapis po wizycie",
            "text": "Dostajesz krótki zapis dla każdej sztuki: [Uzupełnij: w jakiej formie go przekazujesz, np. wydruk, e-mail lub wiadomość]."
          }
        ],
        "note": {